"No.","Time","Source","Destination","Protocol","Length","Info"
"7","0.322143413","192.168.181.180","172.217.24.238","TCP","66","60890  >  443 [ACK] Seq=1 Ack=1 Win=339 Len=0 TSval=3468455117 TSecr=756516858"
"8","0.328638928","172.217.24.238","192.168.181.180","TCP","66","[TCP ACKed unseen segment] 443  >  60890 [ACK] Seq=1 Ack=2 Win=170 Len=0 TSval=756561915 TSecr=3468410005"
"22","0.898204947","192.168.181.180","140.205.203.106","ICMP","100","Destination unreachable (Host unreachable)"
"29","1.599152746","74.125.130.188","192.168.181.180","TCP","345","5228  >  44850 [PSH, ACK] Seq=1 Ack=1 Win=189 Len=279 TSval=3771755314 TSecr=12093734"
"30","1.599207397","74.125.130.188","192.168.181.180","TCP","100","5228  >  44850 [PSH, ACK] Seq=280 Ack=1 Win=189 Len=34 TSval=3771755314 TSecr=12093734"
"33","1.765961444","192.168.181.180","74.125.130.188","TCP","66","44850  >  5228 [ACK] Seq=1 Ack=280 Win=376 Len=0 TSval=12094300 TSecr=3771755314"
"34","1.765970359","192.168.181.180","74.125.130.188","TCP","66","44850  >  5228 [ACK] Seq=1 Ack=314 Win=376 Len=0 TSval=12094300 TSecr=3771755314"
"40","2.370143167","192.168.181.180","172.217.31.3","TCP","66","45298  >  443 [ACK] Seq=1 Ack=1 Win=318 Len=0 TSval=2652052330 TSecr=621627732"
"41","2.375856990","172.217.31.3","192.168.181.180","TCP","66","[TCP ACKed unseen segment] 443  >  45298 [ACK] Seq=1 Ack=2 Win=170 Len=0 TSval=621672788 TSecr=2651995721"
"65","3.095832519","169.45.248.118","192.168.181.180","SSL","123","Continuation Data"
"73","3.542605625","192.168.181.180","144.2.1.1","TCP","74","40753  >  443 [SYN] Seq=0 Win=65535 Len=0 MSS=1460 SACK_PERM=1 TSval=12094478 TSecr=0 WS=256"
"74","3.542622196","192.168.181.180","144.2.1.1","TCP","74","40754  >  443 [SYN] Seq=0 Win=65535 Len=0 MSS=1460 SACK_PERM=1 TSval=12094478 TSecr=0 WS=256"
"75","3.543445198","192.168.181.180","144.2.1.1","TCP","74","40755  >  443 [SYN] Seq=0 Win=65535 Len=0 MSS=1460 SACK_PERM=1 TSval=12094478 TSecr=0 WS=256"
"76","3.567985309","144.2.1.1","192.168.181.180","TCP","74","443  >  40753 [SYN, ACK] Seq=0 Ack=1 Win=65084 Len=0 MSS=1240 SACK_PERM=1 TSval=5205072 TSecr=12094478 WS=4096"
"77","3.569607521","144.2.1.1","192.168.181.180","TCP","74","443  >  40755 [SYN, ACK] Seq=0 Ack=1 Win=65084 Len=0 MSS=1240 SACK_PERM=1 TSval=5196792 TSecr=12094478 WS=4096"
"78","3.570704134","144.2.1.1","192.168.181.180","TCP","74","443  >  40754 [SYN, ACK] Seq=0 Ack=1 Win=65084 Len=0 MSS=1240 SACK_PERM=1 TSval=5205074 TSecr=12094478 WS=4096"
"79","3.577946312","192.168.181.180","144.2.1.1","TCP","66","40753  >  443 [ACK] Seq=1 Ack=1 Win=87808 Len=0 TSval=12094481 TSecr=5205072"
"80","3.577989399","192.168.181.180","144.2.1.1","TCP","66","40755  >  443 [ACK] Seq=1 Ack=1 Win=87808 Len=0 TSval=12094481 TSecr=5196792"
"81","3.578003457","192.168.181.180","144.2.1.1","TCP","66","40754  >  443 [ACK] Seq=1 Ack=1 Win=87808 Len=0 TSval=12094481 TSecr=5205074"
"82","3.590716966","192.168.181.180","144.2.1.1","TCP","74","40756  >  443 [SYN] Seq=0 Win=65535 Len=0 MSS=1460 SACK_PERM=1 TSval=12094483 TSecr=0 WS=256"
"83","3.591440612","192.168.181.180","144.2.1.1","TCP","74","40757  >  443 [SYN] Seq=0 Win=65535 Len=0 MSS=1460 SACK_PERM=1 TSval=12094483 TSecr=0 WS=256"
"84","3.595223860","192.168.181.180","144.2.1.1","TCP","74","40758  >  443 [SYN] Seq=0 Win=65535 Len=0 MSS=1460 SACK_PERM=1 TSval=12094483 TSecr=0 WS=256"
"85","3.599549854","192.168.181.180","144.2.1.1","TLSv1.2","266","Client Hello"
"86","3.600266549","192.168.181.180","144.2.1.1","TLSv1.2","266","Client Hello"
"87","3.600878767","192.168.181.180","144.2.1.1","TLSv1.2","266","Client Hello"
"88","3.617499048","144.2.1.1","192.168.181.180","TCP","74","443  >  40756 [SYN, ACK] Seq=0 Ack=1 Win=65084 Len=0 MSS=1240 SACK_PERM=1 TSval=5205122 TSecr=12094483 WS=4096"
"89","3.617902405","144.2.1.1","192.168.181.180","TCP","74","443  >  40757 [SYN, ACK] Seq=0 Ack=1 Win=65084 Len=0 MSS=1240 SACK_PERM=1 TSval=5196841 TSecr=12094483 WS=4096"
"92","3.620044554","192.168.181.180","144.2.1.1","TCP","66","40756  >  443 [ACK] Seq=1 Ack=1 Win=87808 Len=0 TSval=12094486 TSecr=5205122"
"93","3.620059896","192.168.181.180","144.2.1.1","TCP","66","40757  >  443 [ACK] Seq=1 Ack=1 Win=87808 Len=0 TSval=12094486 TSecr=5196841"
"94","3.620784864","192.168.181.180","144.2.1.1","TLSv1.2","266","Client Hello"
"95","3.624975685","144.2.1.1","192.168.181.180","TCP","66","443  >  40753 [ACK] Seq=1 Ack=201 Win=65536 Len=0 TSval=5205129 TSecr=12094484"
"96","3.626322690","144.2.1.1","192.168.181.180","TCP","66","443  >  40755 [ACK] Seq=1 Ack=201 Win=65536 Len=0 TSval=5196849 TSecr=12094484"
"97","3.628266521","144.2.1.1","192.168.181.180","TLSv1.2","1294","Server Hello"
"98","3.628721946","144.2.1.1","192.168.181.180","TLSv1.2","1820","Certificate, Server Key Exchange, Server Hello Done"
"99","3.629111506","144.2.1.1","192.168.181.180","TCP","66","443  >  40754 [ACK] Seq=1 Ack=201 Win=65536 Len=0 TSval=5205132 TSecr=12094484"
"100","3.629504561","144.2.1.1","192.168.181.180","TCP","74","443  >  40758 [SYN, ACK] Seq=0 Ack=1 Win=65084 Len=0 MSS=1240 SACK_PERM=1 TSval=5196848 TSecr=12094483 WS=4096"
"101","3.633552738","144.2.1.1","192.168.181.180","TLSv1.2","1294","Server Hello"
"102","3.634420823","144.2.1.1","192.168.181.180","TLSv1.2","1820","Certificate, Server Key Exchange, Server Hello Done"
"103","3.634807497","144.2.1.1","192.168.181.180","TLSv1.2","3048","Server Hello, Certificate, Server Key Exchange, Server Hello Done"
"104","3.640329564","192.168.181.180","144.2.1.1","TCP","66","40755  >  443 [ACK] Seq=201 Ack=1229 Win=90112 Len=0 TSval=12094487 TSecr=5196851"
"105","3.640348528","192.168.181.180","144.2.1.1","TCP","66","40755  >  443 [ACK] Seq=201 Ack=2457 Win=92672 Len=0 TSval=12094488 TSecr=5196851"
"106","3.641087856","192.168.181.180","144.2.1.1","TCP","66","40755  >  443 [ACK] Seq=201 Ack=2983 Win=94976 Len=0 TSval=12094488 TSecr=5196851"
"107","3.641445495","192.168.181.180","144.2.1.1","TCP","66","40758  >  443 [ACK] Seq=1 Ack=1 Win=87808 Len=0 TSval=12094488 TSecr=5196848"
"108","3.641456877","192.168.181.180","144.2.1.1","TCP","66","40754  >  443 [ACK] Seq=201 Ack=1229 Win=90112 Len=0 TSval=12094488 TSecr=5205136"
"109","3.641467966","192.168.181.180","144.2.1.1","TCP","66","40754  >  443 [ACK] Seq=201 Ack=2457 Win=92672 Len=0 TSval=12094488 TSecr=5205136"
"110","3.641476362","192.168.181.180","144.2.1.1","TCP","66","40754  >  443 [ACK] Seq=201 Ack=2983 Win=94976 Len=0 TSval=12094488 TSecr=5205136"
"111","3.641486096","192.168.181.180","144.2.1.1","TCP","66","40753  >  443 [ACK] Seq=201 Ack=1229 Win=90112 Len=0 TSval=12094488 TSecr=5205138"
"112","3.642120941","192.168.181.180","144.2.1.1","TCP","66","40753  >  443 [ACK] Seq=201 Ack=2457 Win=92672 Len=0 TSval=12094488 TSecr=5205138"
"113","3.642130146","192.168.181.180","144.2.1.1","TCP","66","40753  >  443 [ACK] Seq=201 Ack=2983 Win=94976 Len=0 TSval=12094488 TSecr=5205138"
"114","3.647595998","144.2.1.1","192.168.181.180","TCP","66","443  >  40756 [ACK] Seq=1 Ack=201 Win=65536 Len=0 TSval=5205152 TSecr=12094486"
"115","3.649767205","144.2.1.1","192.168.181.180","TLSv1.2","1294","Server Hello"
"116","3.650212507","144.2.1.1","192.168.181.180","TLSv1.2","1820","Certificate, Server Key Exchange, Server Hello Done"
"117","3.669724826","192.168.181.180","144.2.1.1","TCP","66","40756  >  443 [ACK] Seq=201 Ack=1229 Win=90112 Len=0 TSval=12094490 TSecr=5205154"
"118","3.669759361","192.168.181.180","144.2.1.1","TCP","66","40756  >  443 [ACK] Seq=201 Ack=2457 Win=92672 Len=0 TSval=12094490 TSecr=5205154"
"119","3.669770286","192.168.181.180","144.2.1.1","TCP","66","40756  >  443 [ACK] Seq=201 Ack=2983 Win=94976 Len=0 TSval=12094490 TSecr=5205154"
"123","3.697016802","192.168.181.180","144.2.1.1","TLSv1.2","192","Client Key Exchange, Change Cipher Spec, Hello Request, Hello Request"
"124","3.700142832","192.168.181.180","144.2.1.1","TLSv1.2","266","Client Hello"
"125","3.718406414","192.168.181.180","144.2.1.1","TLSv1.2","192","Client Key Exchange, Change Cipher Spec, Hello Request, Hello Request"
"126","3.723920969","144.2.1.1","192.168.181.180","TLSv1.2","117","Change Cipher Spec, Encrypted Handshake Message"
"127","3.724312103","144.2.1.1","192.168.181.180","TLSv1.2","116","Application Data"
"128","3.724321011","144.2.1.1","192.168.181.180","TLSv1.2","108","Application Data"
"129","3.726593757","144.2.1.1","192.168.181.180","TCP","66","443  >  40757 [ACK] Seq=1 Ack=201 Win=65536 Len=0 TSval=5196949 TSecr=12094494"
"130","3.728177904","144.2.1.1","192.168.181.180","TLSv1.2","1294","Server Hello"
"131","3.728591545","144.2.1.1","192.168.181.180","TLSv1.2","1820","Certificate, Server Key Exchange, Server Hello Done"
"132","3.732697530","192.168.181.180","144.2.1.1","TCP","66","40757  >  443 [ACK] Seq=201 Ack=1229 Win=90112 Len=0 TSval=12094497 TSecr=5196951"
"133","3.732706481","192.168.181.180","144.2.1.1","TCP","66","40757  >  443 [ACK] Seq=201 Ack=2457 Win=92672 Len=0 TSval=12094497 TSecr=5196951"
"134","3.732712462","192.168.181.180","144.2.1.1","TCP","66","40757  >  443 [ACK] Seq=201 Ack=2983 Win=94976 Len=0 TSval=12094497 TSecr=5196951"
"135","3.737475805","192.168.181.180","144.2.1.1","TLSv1.2","192","Client Key Exchange, Change Cipher Spec, Hello Request, Hello Request"
"136","3.744750577","144.2.1.1","192.168.181.180","TLSv1.2","117","Change Cipher Spec, Encrypted Handshake Message"
"137","3.745129415","144.2.1.1","192.168.181.180","TLSv1.2","116","Application Data"
"138","3.745139408","144.2.1.1","192.168.181.180","TLSv1.2","108","Application Data"
"139","3.752870296","192.168.181.180","144.2.1.1","TLSv1.2","192","Client Key Exchange, Change Cipher Spec, Hello Request, Hello Request"
"140","3.763191842","192.168.181.180","144.2.1.1","TCP","66","40755  >  443 [ACK] Seq=327 Ack=3034 Win=94976 Len=0 TSval=12094500 TSecr=5196967"
"141","3.763988172","192.168.181.180","144.2.1.1","TCP","66","40755  >  443 [ACK] Seq=327 Ack=3084 Win=94976 Len=0 TSval=12094500 TSecr=5196968"
"142","3.763997393","192.168.181.180","144.2.1.1","TCP","66","40755  >  443 [ACK] Seq=327 Ack=3126 Win=94976 Len=0 TSval=12094500 TSecr=5196968"
"143","3.765615481","144.2.1.1","192.168.181.180","TLSv1.2","117","Change Cipher Spec, Encrypted Handshake Message"
"144","3.766023512","144.2.1.1","192.168.181.180","TLSv1.2","116","Application Data"
"145","3.766039376","144.2.1.1","192.168.181.180","TLSv1.2","108","Application Data"
"146","3.768722685","192.168.181.180","144.2.1.1","TCP","66","40756  >  443 [ACK] Seq=327 Ack=3126 Win=94976 Len=0 TSval=12094501 TSecr=5205228"
"147","3.771742938","192.168.181.180","144.2.1.1","TLSv1.2","192","Client Key Exchange, Change Cipher Spec, Hello Request, Hello Request"
"148","3.772410680","192.168.181.180","144.2.1.1","TLSv1.2","266","Client Hello"
"149","3.775704790","192.168.181.180","144.2.1.1","TCP","66","40754  >  443 [ACK] Seq=327 Ack=3034 Win=94976 Len=0 TSval=12094501 TSecr=5205269"
"150","3.776734268","192.168.181.180","144.2.1.1","TCP","66","40754  >  443 [ACK] Seq=327 Ack=3084 Win=94976 Len=0 TSval=12094501 TSecr=5205269"
"151","3.776747899","192.168.181.180","144.2.1.1","TCP","66","40754  >  443 [ACK] Seq=327 Ack=3126 Win=94976 Len=0 TSval=12094501 TSecr=5205269"
"152","3.779848300","144.2.1.1","192.168.181.180","TLSv1.2","117","Change Cipher Spec, Encrypted Handshake Message"
"153","3.780259289","144.2.1.1","192.168.181.180","TLSv1.2","116","Application Data"
"154","3.780274284","144.2.1.1","192.168.181.180","TLSv1.2","108","Application Data"
"155","3.798320476","144.2.1.1","192.168.181.180","TLSv1.2","117","Change Cipher Spec, Encrypted Handshake Message"
"156","3.798730057","144.2.1.1","192.168.181.180","TLSv1.2","116","Application Data"
"157","3.798783246","144.2.1.1","192.168.181.180","TLSv1.2","108","Application Data"
"158","3.799911829","192.168.181.180","144.2.1.1","TCP","66","40753  >  443 [ACK] Seq=327 Ack=3034 Win=94976 Len=0 TSval=12094504 TSecr=5205284"
"159","3.802680064","192.168.181.180","144.2.1.1","TCP","66","40753  >  443 [ACK] Seq=327 Ack=3084 Win=94976 Len=0 TSval=12094504 TSecr=5205284"
"160","3.802687700","192.168.181.180","144.2.1.1","TCP","66","40753  >  443 [ACK] Seq=327 Ack=3126 Win=94976 Len=0 TSval=12094504 TSecr=5205284"
"161","3.802696210","192.168.181.180","144.2.1.1","TCP","66","40757  >  443 [ACK] Seq=327 Ack=3034 Win=94976 Len=0 TSval=12094504 TSecr=5197021"
"162","3.803152459","192.168.181.180","144.2.1.1","TCP","66","40757  >  443 [ACK] Seq=327 Ack=3084 Win=94976 Len=0 TSval=12094504 TSecr=5197021"
"163","3.803160062","192.168.181.180","144.2.1.1","TCP","66","40757  >  443 [ACK] Seq=327 Ack=3126 Win=94976 Len=0 TSval=12094504 TSecr=5197021"
"164","3.806500348","144.2.1.1","192.168.181.180","TCP","66","443  >  40758 [ACK] Seq=1 Ack=201 Win=65536 Len=0 TSval=5197025 TSecr=12094501"
"165","3.809082095","144.2.1.1","192.168.181.180","TLSv1.2","1294","Server Hello"
"166","3.809852550","144.2.1.1","192.168.181.180","TLSv1.2","1820","Certificate, Server Key Exchange, Server Hello Done"
"168","3.825507151","192.168.181.180","144.2.1.1","TCP","66","40758  >  443 [ACK] Seq=201 Ack=1229 Win=90112 Len=0 TSval=12094506 TSecr=5197027"
"169","3.826228404","192.168.181.180","144.2.1.1","TCP","66","40758  >  443 [ACK] Seq=201 Ack=2457 Win=92672 Len=0 TSval=12094506 TSecr=5197027"
"170","3.826239048","192.168.181.180","144.2.1.1","TCP","66","40758  >  443 [ACK] Seq=201 Ack=2983 Win=94976 Len=0 TSval=12094506 TSecr=5197027"
"171","3.844284741","192.168.181.180","144.2.1.1","TLSv1.2","192","Client Key Exchange, Change Cipher Spec, Hello Request, Hello Request"
"173","3.878652755","144.2.1.1","192.168.181.180","TLSv1.2","117","Change Cipher Spec, Encrypted Handshake Message"
"174","3.879062165","144.2.1.1","192.168.181.180","TLSv1.2","116","Application Data"
"175","3.879076979","144.2.1.1","192.168.181.180","TLSv1.2","108","Application Data"
"176","3.923505223","192.168.181.180","144.2.1.1","TCP","66","40758  >  443 [ACK] Seq=327 Ack=3126 Win=94976 Len=0 TSval=12094516 TSecr=5197097"
"181","4.101725674","192.168.181.180","144.2.1.1","TCP","66","40755  >  443 [RST, ACK] Seq=327 Ack=3126 Win=94976 Len=0 TSval=12094534 TSecr=5196968"
"182","4.101743755","192.168.181.180","144.2.1.1","TCP","66","40754  >  443 [RST, ACK] Seq=327 Ack=3126 Win=94976 Len=0 TSval=12094534 TSecr=5205269"
"183","4.101764538","192.168.181.180","144.2.1.1","TCP","66","40753  >  443 [RST, ACK] Seq=327 Ack=3126 Win=94976 Len=0 TSval=12094534 TSecr=5205284"
"184","4.102845776","192.168.181.180","144.2.1.1","TCP","66","40757  >  443 [RST, ACK] Seq=327 Ack=3126 Win=94976 Len=0 TSval=12094534 TSecr=5197021"
"185","4.103362204","192.168.181.180","144.2.1.1","TCP","66","40758  >  443 [RST, ACK] Seq=327 Ack=3126 Win=94976 Len=0 TSval=12094534 TSecr=5197097"
"186","4.104376371","192.168.181.180","144.2.1.1","TLSv1.2","119","Application Data"
"187","4.104391937","192.168.181.180","144.2.1.1","TLSv1.2","122","Application Data"
"188","4.106747148","192.168.181.180","144.2.1.1","TLSv1.2","108","Application Data"
"189","4.110693685","192.168.181.180","144.2.1.1","TLSv1.2","104","Application Data"
"190","4.120234564","192.168.181.180","144.2.1.1","TLSv1.2","1100","Application Data"
"191","4.120253478","192.168.181.180","144.2.1.1","TLSv1.2","274","Application Data"
"192","4.120873931","192.168.181.180","144.2.1.1","TLSv1.2","216","Application Data"
"193","4.121451992","192.168.181.180","144.2.1.1","TLSv1.2","128","Application Data"
"194","4.121471011","192.168.181.180","144.2.1.1","TLSv1.2","216","Application Data"
"195","4.132845366","144.2.1.1","192.168.181.180","TCP","66","443  >  40756 [ACK] Seq=3126 Ack=436 Win=65536 Len=0 TSval=5205637 TSecr=12094534"
"196","4.133270738","144.2.1.1","192.168.181.180","TLSv1.2","104","Application Data"
"197","4.139128430","144.2.1.1","192.168.181.180","TCP","66","443  >  40756 [ACK] Seq=3164 Ack=516 Win=65536 Len=0 TSval=5205643 TSecr=12094534"
"199","4.147264269","144.2.1.1","192.168.181.180","TCP","66","443  >  40756 [ACK] Seq=3164 Ack=1758 Win=65536 Len=0 TSval=5205652 TSecr=12094535"
"200","4.150596507","144.2.1.1","192.168.181.180","TCP","66","443  >  40756 [ACK] Seq=3164 Ack=2120 Win=65536 Len=0 TSval=5205655 TSecr=12094535"
"201","4.159542964","192.168.181.180","144.2.1.1","TLSv1.2","230","Application Data"
"202","4.207814457","192.168.181.180","144.2.1.1","TLSv1.2","1294","Application Data, Application Data, Application Data"
"203","4.210122695","192.168.181.180","144.2.1.1","TCP","1294","[TCP segment of a reassembled PDU]"
"204","4.211106512","192.168.181.180","144.2.1.1","TLSv1.2","732","Application Data"
"205","4.211123737","192.168.181.180","144.2.1.1","TCP","66","40756  >  443 [ACK] Seq=5406 Ack=3164 Win=94976 Len=0 TSval=12094541 TSecr=5205637"
"206","4.224776390","144.2.1.1","192.168.181.180","TLSv1.2","785","Application Data"
"207","4.225191714","144.2.1.1","192.168.181.180","TLSv1.2","128","Application Data"
"208","4.237849439","144.2.1.1","192.168.181.180","TCP","66","443  >  40756 [ACK] Seq=3945 Ack=4740 Win=65536 Len=0 TSval=5205742 TSecr=12094541"
"209","4.241781482","144.2.1.1","192.168.181.180","TLSv1.2","247","Application Data"
"210","4.242059244","144.2.1.1","192.168.181.180","TLSv1.2","309","Application Data"
"211","4.244913833","192.168.181.180","144.2.1.1","TCP","66","40756  >  443 [ACK] Seq=5406 Ack=3883 Win=97536 Len=0 TSval=12094548 TSecr=5205729"
"212","4.244946123","192.168.181.180","144.2.1.1","TCP","66","40756  >  443 [ACK] Seq=5406 Ack=3945 Win=97536 Len=0 TSval=12094548 TSecr=5205729"
"213","4.244961528","192.168.181.180","144.2.1.1","TCP","66","40756  >  443 [ACK] Seq=5406 Ack=4126 Win=100096 Len=0 TSval=12094548 TSecr=5205745"
"214","4.244986912","192.168.181.180","144.2.1.1","TCP","66","40756  >  443 [ACK] Seq=5406 Ack=4369 Win=100096 Len=0 TSval=12094548 TSecr=5205745"
"215","4.297211593","144.2.1.1","192.168.181.180","TLSv1.2","154","Application Data"
"216","4.297543179","144.2.1.1","192.168.181.180","TLSv1.2","282","Application Data"
"217","4.302819187","192.168.181.180","144.2.1.1","TCP","66","40756  >  443 [ACK] Seq=5406 Ack=4457 Win=100096 Len=0 TSval=12094554 TSecr=5205801"
"218","4.303728537","192.168.181.180","144.2.1.1","TCP","66","40756  >  443 [ACK] Seq=5406 Ack=4673 Win=100096 Len=0 TSval=12094554 TSecr=5205801"
"219","4.336001277","144.2.1.1","192.168.181.180","TLSv1.2","166","Application Data"
"220","4.336397849","144.2.1.1","192.168.181.180","TLSv1.2","1123","Application Data"
"221","4.336416517","144.2.1.1","192.168.181.180","TCP","2522","[TCP segment of a reassembled PDU]"
"222","4.336957769","144.2.1.1","192.168.181.180","TLSv1.2","1049","Application Data"
"223","4.340180516","144.2.1.1","192.168.181.180","TLSv1.2","154","Application Data"
"224","4.341005109","144.2.1.1","192.168.181.180","TLSv1.2","529","Application Data"
"225","4.341442135","192.168.181.180","144.2.1.1","TCP","66","40756  >  443 [ACK] Seq=5406 Ack=4773 Win=100096 Len=0 TSval=12094558 TSecr=5205840"
"226","4.344362073","192.168.181.180","144.2.1.1","TCP","66","40756  >  443 [ACK] Seq=5406 Ack=5830 Win=102400 Len=0 TSval=12094558 TSecr=5205840"
"227","4.344387963","192.168.181.180","144.2.1.1","TCP","66","40756  >  443 [ACK] Seq=5406 Ack=7058 Win=104960 Len=0 TSval=12094558 TSecr=5205840"
"228","4.344829673","192.168.181.180","144.2.1.1","TCP","66","40756  >  443 [ACK] Seq=5406 Ack=8286 Win=107264 Len=0 TSval=12094558 TSecr=5205840"
"229","4.344850261","192.168.181.180","144.2.1.1","TCP","66","40756  >  443 [ACK] Seq=5406 Ack=9269 Win=109824 Len=0 TSval=12094558 TSecr=5205840"
"230","4.344860034","192.168.181.180","144.2.1.1","TCP","66","40756  >  443 [ACK] Seq=5406 Ack=9357 Win=109824 Len=0 TSval=12094558 TSecr=5205843"
"231","4.345402680","192.168.181.180","144.2.1.1","TCP","66","40756  >  443 [ACK] Seq=5406 Ack=9820 Win=112384 Len=0 TSval=12094558 TSecr=5205843"
"232","4.349179034","192.168.181.180","104.244.42.65","TCP","66","35483  >  443 [FIN, ACK] Seq=1 Ack=1 Win=396 Len=0 TSval=12094559 TSecr=2182380926"
"233","4.352605597","192.168.181.180","104.244.42.198","TCP","66","48620  >  443 [FIN, ACK] Seq=1 Ack=1 Win=396 Len=0 TSval=12094559 TSecr=2190024973"
"234","4.375419005","144.2.1.1","192.168.181.180","TLSv1.2","149","Application Data"
"235","4.375818752","144.2.1.1","192.168.181.180","TLSv1.2","329","Application Data"
"236","4.381222817","192.168.181.180","144.2.1.1","TCP","66","40756  >  443 [ACK] Seq=5406 Ack=9903 Win=112384 Len=0 TSval=12094562 TSecr=5205878"
"237","4.381845451","192.168.181.180","144.2.1.1","TCP","66","40756  >  443 [ACK] Seq=5406 Ack=10166 Win=112384 Len=0 TSval=12094562 TSecr=5205878"
"238","4.418099817","192.168.181.180","157.240.16.20","TCP","66","41728  >  443 [ACK] Seq=1 Ack=1 Win=282 Len=0 TSval=660857459 TSecr=1210275240"
"239","4.425263451","104.244.42.198","192.168.181.180","TLSv1.2","97","Encrypted Alert"
"240","4.425751754","104.244.42.198","192.168.181.180","TCP","66","443  >  48620 [FIN, ACK] Seq=32 Ack=2 Win=125 Len=0 TSval=2190533230 TSecr=12094559"
"241","4.433650127","104.244.42.65","192.168.181.180","TLSv1.2","97","Encrypted Alert"
"242","4.434049186","104.244.42.65","192.168.181.180","TCP","66","443  >  35483 [FIN, ACK] Seq=32 Ack=2 Win=150 Len=0 TSval=2182880334 TSecr=12094559"
"243","4.441604413","192.168.181.180","104.244.42.198","TCP","54","48620  >  443 [RST] Seq=2 Win=0 Len=0"
"244","4.442482641","192.168.181.180","104.244.42.198","TCP","54","48620  >  443 [RST] Seq=2 Win=0 Len=0"
"245","4.442489074","192.168.181.180","104.244.42.65","TCP","54","35483  >  443 [RST] Seq=2 Win=0 Len=0"
"246","4.442994470","192.168.181.180","104.244.42.65","TCP","54","35483  >  443 [RST] Seq=2 Win=0 Len=0"
"247","4.448961637","157.240.16.20","192.168.181.180","TCP","66","[TCP ACKed unseen segment] 443  >  41728 [ACK] Seq=1 Ack=2 Win=122 Len=0 TSval=1210320569 TSecr=660846128"
"252","4.539761492","157.240.16.11","192.168.181.180","TCP","66","443  >  35468 [FIN, ACK] Seq=1 Ack=1 Win=126 Len=0 TSval=2497585152 TSecr=6538165"
"258","4.854541672","144.2.1.1","192.168.181.180","TLSv1.2","177","Application Data"
"259","4.854732586","144.2.1.1","192.168.181.180","TLSv1.2","378","Application Data"
"272","5.039841031","157.240.16.32","192.168.181.180","TLSv1.2","97","Encrypted Alert"
"273","5.053495788","192.168.181.180","144.2.1.1","TCP","66","40756  >  443 [ACK] Seq=5406 Ack=10277 Win=112384 Len=0 TSval=12094629 TSecr=5206359"
"274","5.053507299","192.168.181.180","144.2.1.1","TCP","66","40756  >  443 [ACK] Seq=5406 Ack=10589 Win=114688 Len=0 TSval=12094629 TSecr=5206359"
"317","6.146154201","192.168.181.180","169.45.248.118","ICMP","151","Destination unreachable (Host unreachable)"
"318","6.146182717","192.168.181.180","157.240.16.11","ICMP","94","Destination unreachable (Host unreachable)"
"319","6.146191497","192.168.181.180","157.240.16.32","ICMP","125","Destination unreachable (Host unreachable)"
"333","6.887403162","192.168.181.180","157.240.16.35","TLSv1.2","162","Application Data"
"334","6.887496248","192.168.181.180","157.240.16.35","TLSv1.2","112","Application Data"
"335","6.887525902","192.168.181.180","157.240.16.35","TLSv1.2","556","Application Data"
"336","6.917915767","157.240.16.35","192.168.181.180","TLSv1.2","108","Application Data"
"337","6.917962650","192.168.181.180","157.240.16.35","TCP","66","52834  >  443 [ACK] Seq=633 Ack=43 Win=1118 Len=0 TSval=1746328702 TSecr=1207455603"
"338","6.918057162","157.240.16.35","192.168.181.180","TLSv1.2","112","Application Data"
"339","6.918065572","192.168.181.180","157.240.16.35","TCP","66","52834  >  443 [ACK] Seq=633 Ack=89 Win=1118 Len=0 TSval=1746328702 TSecr=1207455603"
"342","6.952870992","192.168.181.180","128.119.245.12","TCP","74","58276  >  80 [SYN] Seq=0 Win=29200 Len=0 MSS=1460 SACK_PERM=1 TSval=1727084159 TSecr=0 WS=128"
"347","7.148832158","157.240.16.35","192.168.181.180","TLSv1.2","337","Application Data"
"348","7.148891791","192.168.181.180","157.240.16.35","TCP","66","52834  >  443 [ACK] Seq=633 Ack=360 Win=1140 Len=0 TSval=1746328760 TSecr=1207455834"
"351","7.197657862","128.119.245.12","192.168.181.180","TCP","74","80  >  58276 [SYN, ACK] Seq=0 Ack=1 Win=28960 Len=0 MSS=1380 SACK_PERM=1 TSval=3521383448 TSecr=1727084159 WS=128"
"352","7.197746546","192.168.181.180","128.119.245.12","TCP","66","58276  >  80 [ACK] Seq=1 Ack=1 Win=29312 Len=0 TSval=1727084220 TSecr=3521383448"
"353","7.197884315","192.168.181.180","128.119.245.12","TCP","74","58278  >  80 [SYN] Seq=0 Win=29200 Len=0 MSS=1460 SACK_PERM=1 TSval=1727084220 TSecr=0 WS=128"
"354","7.198614341","192.168.181.180","128.119.245.12","TCP","716","58276  >  80 [PSH, ACK] Seq=1 Ack=1 Win=29312 Len=650 TSval=1727084221 TSecr=3521383448"
"355","7.198928502","192.168.181.180","128.119.245.12","TCP","1434","58276  >  80 [ACK] Seq=651 Ack=1 Win=29312 Len=1368 TSval=1727084221 TSecr=3521383448"
"356","7.198950673","192.168.181.180","128.119.245.12","TCP","1434","58276  >  80 [ACK] Seq=2019 Ack=1 Win=29312 Len=1368 TSval=1727084221 TSecr=3521383448"
"357","7.198997762","192.168.181.180","128.119.245.12","TCP","1434","58276  >  80 [ACK] Seq=3387 Ack=1 Win=29312 Len=1368 TSval=1727084221 TSecr=3521383448"
"358","7.199006036","192.168.181.180","128.119.245.12","TCP","1434","58276  >  80 [ACK] Seq=4755 Ack=1 Win=29312 Len=1368 TSval=1727084221 TSecr=3521383448"
"359","7.199172340","192.168.181.180","128.119.245.12","TCP","1434","58276  >  80 [ACK] Seq=6123 Ack=1 Win=29312 Len=1368 TSval=1727084221 TSecr=3521383448"
"360","7.199231236","192.168.181.180","128.119.245.12","TCP","1434","58276  >  80 [ACK] Seq=7491 Ack=1 Win=29312 Len=1368 TSval=1727084221 TSecr=3521383448"
"361","7.199351073","192.168.181.180","128.119.245.12","TCP","1434","58276  >  80 [ACK] Seq=8859 Ack=1 Win=29312 Len=1368 TSval=1727084221 TSecr=3521383448"
"362","7.199529962","192.168.181.180","128.119.245.12","TCP","1434","58276  >  80 [ACK] Seq=10227 Ack=1 Win=29312 Len=1368 TSval=1727084221 TSecr=3521383448"
"363","7.199581551","192.168.181.180","128.119.245.12","TCP","1434","58276  >  80 [ACK] Seq=11595 Ack=1 Win=29312 Len=1368 TSval=1727084221 TSecr=3521383448"
"364","7.442762718","128.119.245.12","192.168.181.180","TCP","74","80  >  58278 [SYN, ACK] Seq=0 Ack=1 Win=28960 Len=0 MSS=1380 SACK_PERM=1 TSval=3521383693 TSecr=1727084220 WS=128"
"365","7.442807370","192.168.181.180","128.119.245.12","TCP","66","58278  >  80 [ACK] Seq=1 Ack=1 Win=29312 Len=0 TSval=1727084282 TSecr=3521383693"
"366","7.443436489","128.119.245.12","192.168.181.180","TCP","66","80  >  58276 [ACK] Seq=1 Ack=651 Win=30336 Len=0 TSval=3521383694 TSecr=1727084221"
"367","7.443453586","192.168.181.180","128.119.245.12","TCP","1434","58276  >  80 [ACK] Seq=12963 Ack=1 Win=29312 Len=1368 TSval=1727084282 TSecr=3521383694"
"368","7.444116981","128.119.245.12","192.168.181.180","TCP","66","80  >  58276 [ACK] Seq=1 Ack=2019 Win=33280 Len=0 TSval=3521383694 TSecr=1727084221"
"369","7.444123831","192.168.181.180","128.119.245.12","TCP","1434","58276  >  80 [PSH, ACK] Seq=14331 Ack=1 Win=29312 Len=1368 TSval=1727084282 TSecr=3521383694"
"370","7.444126851","128.119.245.12","192.168.181.180","TCP","66","80  >  58276 [ACK] Seq=1 Ack=3387 Win=36096 Len=0 TSval=3521383694 TSecr=1727084221"
"371","7.444132126","192.168.181.180","128.119.245.12","TCP","1434","58276  >  80 [ACK] Seq=15699 Ack=1 Win=29312 Len=1368 TSval=1727084282 TSecr=3521383694"
"372","7.444241569","128.119.245.12","192.168.181.180","TCP","66","80  >  58276 [ACK] Seq=1 Ack=4755 Win=39040 Len=0 TSval=3521383694 TSecr=1727084221"
"373","7.444251101","192.168.181.180","128.119.245.12","TCP","1434","58276  >  80 [ACK] Seq=17067 Ack=1 Win=29312 Len=1368 TSval=1727084282 TSecr=3521383694"
"374","7.444303138","128.119.245.12","192.168.181.180","TCP","66","80  >  58276 [ACK] Seq=1 Ack=6123 Win=41856 Len=0 TSval=3521383695 TSecr=1727084221"
"375","7.444320508","192.168.181.180","128.119.245.12","TCP","1434","58276  >  80 [ACK] Seq=18435 Ack=1 Win=29312 Len=1368 TSval=1727084282 TSecr=3521383695"
"376","7.444434258","128.119.245.12","192.168.181.180","TCP","66","80  >  58276 [ACK] Seq=1 Ack=7491 Win=44800 Len=0 TSval=3521383695 TSecr=1727084221"
"377","7.444447017","192.168.181.180","128.119.245.12","TCP","1434","58276  >  80 [ACK] Seq=19803 Ack=1 Win=29312 Len=1368 TSval=1727084282 TSecr=3521383695"
"378","7.444713817","128.119.245.12","192.168.181.180","TCP","66","80  >  58276 [ACK] Seq=1 Ack=8859 Win=47744 Len=0 TSval=3521383695 TSecr=1727084221"
"379","7.444720031","192.168.181.180","128.119.245.12","TCP","1434","58276  >  80 [ACK] Seq=21171 Ack=1 Win=29312 Len=1368 TSval=1727084282 TSecr=3521383695"
"380","7.444778977","128.119.245.12","192.168.181.180","TCP","78","[TCP Dup ACK 378#1] 80  >  58276 [PSH, ACK] Seq=1 Ack=8859 Win=47744 Len=0 TSval=3521383695 TSecr=1727084221 SLE=15699 SRE=17067"
"381","7.444793641","192.168.181.180","128.119.245.12","TCP","1434","[TCP Out-Of-Order] 58276  >  80 [ACK] Seq=8859 Ack=1 Win=29312 Len=1368 TSval=1727084282 TSecr=3521383695"
"382","7.444797821","128.119.245.12","192.168.181.180","TCP","66","80  >  58276 [ACK] Seq=1 Ack=10227 Win=50560 Len=0 TSval=3521383695 TSecr=1727084221"
"383","7.444806451","192.168.181.180","128.119.245.12","TCP","1434","58276  >  80 [ACK] Seq=22539 Ack=1 Win=29312 Len=1368 TSval=1727084282 TSecr=3521383695"
"384","7.444828522","192.168.181.180","128.119.245.12","TCP","1434","58276  >  80 [ACK] Seq=23907 Ack=1 Win=29312 Len=1368 TSval=1727084282 TSecr=3521383695"
"385","7.444983186","128.119.245.12","192.168.181.180","TCP","66","80  >  58276 [ACK] Seq=1 Ack=11595 Win=53504 Len=0 TSval=3521383695 TSecr=1727084221"
"386","7.444995625","192.168.181.180","128.119.245.12","TCP","1434","58276  >  80 [PSH, ACK] Seq=25275 Ack=1 Win=29312 Len=1368 TSval=1727084282 TSecr=3521383695"
"387","7.444998812","128.119.245.12","192.168.181.180","TCP","66","80  >  58276 [ACK] Seq=1 Ack=12963 Win=56448 Len=0 TSval=3521383695 TSecr=1727084221"
"388","7.445003262","128.119.245.12","192.168.181.180","TCP","86","[TCP Dup ACK 387#1] 80  >  58276 [PSH, ACK] Seq=1 Ack=12963 Win=56448 Len=0 TSval=3521383695 TSecr=1727084221 SLE=18435 SRE=19803 SLE=15699 SRE=17067"
"389","7.445027451","192.168.181.180","128.119.245.12","TCP","1434","58276  >  80 [ACK] Seq=26643 Ack=1 Win=29312 Len=1368 TSval=1727084282 TSecr=3521383695"
"390","7.445175701","192.168.181.180","128.119.245.12","TCP","1434","58276  >  80 [ACK] Seq=28011 Ack=1 Win=29312 Len=1368 TSval=1727084282 TSecr=3521383695"
"391","7.445280633","128.119.245.12","192.168.181.180","TCP","94","[TCP Dup ACK 387#2] 80  >  58276 [PSH, ACK] Seq=1 Ack=12963 Win=56448 Len=0 TSval=3521383695 TSecr=1727084221 SLE=21171 SRE=22539 SLE=18435 SRE=19803 SLE=15699 SRE=17067"
"392","7.445308914","192.168.181.180","128.119.245.12","TCP","1434","58276  >  80 [ACK] Seq=29379 Ack=1 Win=29312 Len=1368 TSval=1727084282 TSecr=3521383695"
"393","7.445493821","128.119.245.12","192.168.181.180","TCP","94","[TCP Dup ACK 387#3] 80  >  58276 [PSH, ACK] Seq=1 Ack=12963 Win=56448 Len=0 TSval=3521383695 TSecr=1727084221 SLE=21171 SRE=23907 SLE=18435 SRE=19803 SLE=15699 SRE=17067"
"394","7.445524259","192.168.181.180","128.119.245.12","TCP","1434","58276  >  80 [ACK] Seq=30747 Ack=1 Win=29312 Len=1368 TSval=1727084282 TSecr=3521383695"
"395","7.445724825","128.119.245.12","192.168.181.180","TCP","94","[TCP Dup ACK 387#4] 80  >  58276 [PSH, ACK] Seq=1 Ack=12963 Win=56448 Len=0 TSval=3521383695 TSecr=1727084221 SLE=25275 SRE=26643 SLE=21171 SRE=23907 SLE=18435 SRE=19803"
"396","7.445745517","192.168.181.180","128.119.245.12","TCP","1434","58276  >  80 [ACK] Seq=32115 Ack=1 Win=29312 Len=1368 TSval=1727084282 TSecr=3521383695"
"397","7.445968044","128.119.245.12","192.168.181.180","TCP","94","[TCP Dup ACK 387#5] 80  >  58276 [PSH, ACK] Seq=1 Ack=12963 Win=56448 Len=0 TSval=3521383695 TSecr=1727084221 SLE=25275 SRE=28011 SLE=21171 SRE=23907 SLE=18435 SRE=19803"
"398","7.445991034","192.168.181.180","128.119.245.12","TCP","1434","[TCP Fast Retransmission] 58276  >  80 [ACK] Seq=12963 Ack=1 Win=29312 Len=1368 TSval=1727084282 TSecr=3521383695"
"399","7.446454828","128.119.245.12","192.168.181.180","TCP","94","[TCP Dup ACK 387#6] 80  >  58276 [PSH, ACK] Seq=1 Ack=12963 Win=56448 Len=0 TSval=3521383695 TSecr=1727084221 SLE=29379 SRE=30747 SLE=25275 SRE=28011 SLE=21171 SRE=23907"
"400","7.446492057","192.168.181.180","128.119.245.12","TCP","1434","[TCP Out-Of-Order] 58276  >  80 [PSH, ACK] Seq=14331 Ack=1 Win=29312 Len=1368 TSval=1727084283 TSecr=3521383695"
"401","7.446547653","128.119.245.12","192.168.181.180","TCP","94","[TCP Dup ACK 387#7] 80  >  58276 [PSH, ACK] Seq=1 Ack=12963 Win=56448 Len=0 TSval=3521383695 TSecr=1727084221 SLE=29379 SRE=32115 SLE=25275 SRE=28011 SLE=21171 SRE=23907"
"402","7.446567539","192.168.181.180","128.119.245.12","TCP","1434","[TCP Out-Of-Order] 58276  >  80 [ACK] Seq=17067 Ack=1 Win=29312 Len=1368 TSval=1727084283 TSecr=3521383695"
"405","7.690031202","128.119.245.12","192.168.181.180","TCP","78","[TCP Dup ACK 387#8] 80  >  58276 [ACK] Seq=1 Ack=12963 Win=56448 Len=0 TSval=3521383940 TSecr=1727084221 SLE=8859 SRE=10227"
"406","7.690086760","192.168.181.180","128.119.245.12","TCP","1434","[TCP Out-Of-Order] 58276  >  80 [ACK] Seq=19803 Ack=1 Win=29312 Len=1368 TSval=1727084343 TSecr=3521383940"
"407","7.691587963","128.119.245.12","192.168.181.180","TCP","66","80  >  58276 [ACK] Seq=1 Ack=14331 Win=59264 Len=0 TSval=3521383942 TSecr=1727084282"
"408","7.691653384","192.168.181.180","128.119.245.12","TCP","1434","[TCP Retransmission] 58276  >  80 [ACK] Seq=23907 Ack=1 Win=29312 Len=1368 TSval=1727084344 TSecr=3521383942"
"409","7.691666730","192.168.181.180","128.119.245.12","TCP","1434","58276  >  80 [ACK] Seq=33483 Ack=1 Win=29312 Len=1368 TSval=1727084344 TSecr=3521383942"
"410","7.691715151","128.119.245.12","192.168.181.180","TCP","66","80  >  58276 [ACK] Seq=1 Ack=15699 Win=62208 Len=0 TSval=3521383942 TSecr=1727084283"
"411","7.691733564","192.168.181.180","128.119.245.12","TCP","1434","58276  >  80 [ACK] Seq=34851 Ack=1 Win=29312 Len=1368 TSval=1727084344 TSecr=3521383942"
"412","7.691738355","128.119.245.12","192.168.181.180","TCP","66","80  >  58276 [ACK] Seq=1 Ack=17067 Win=65024 Len=0 TSval=3521383942 TSecr=1727084283"
"413","7.691750533","192.168.181.180","128.119.245.12","TCP","1434","[TCP Out-Of-Order] 58276  >  80 [ACK] Seq=28011 Ack=1 Win=29312 Len=1368 TSval=1727084344 TSecr=3521383942"
"414","7.691818175","128.119.245.12","192.168.181.180","TCP","66","80  >  58276 [ACK] Seq=1 Ack=18435 Win=67968 Len=0 TSval=3521383942 TSecr=1727084283"
"415","7.691833741","128.119.245.12","192.168.181.180","TCP","66","80  >  58276 [ACK] Seq=1 Ack=19803 Win=70912 Len=0 TSval=3521383942 TSecr=1727084283"
"416","7.691881892","192.168.181.180","128.119.245.12","TCP","1434","58276  >  80 [PSH, ACK] Seq=36219 Ack=1 Win=29312 Len=1368 TSval=1727084344 TSecr=3521383942"
"417","7.697078937","128.119.245.12","192.168.181.180","TCP","78","[TCP Dup ACK 415#1] 80  >  58276 [ACK] Seq=1 Ack=19803 Win=70912 Len=0 TSval=3521383947 TSecr=1727084283 SLE=12963 SRE=14331"
"418","7.697128697","128.119.245.12","192.168.181.180","TCP","78","[TCP Dup ACK 415#2] 80  >  58276 [ACK] Seq=1 Ack=19803 Win=70912 Len=0 TSval=3521383947 TSecr=1727084283 SLE=14331 SRE=15699"
"419","7.697243663","128.119.245.12","192.168.181.180","TCP","78","[TCP Dup ACK 415#3] 80  >  58276 [ACK] Seq=1 Ack=19803 Win=70912 Len=0 TSval=3521383947 TSecr=1727084283 SLE=17067 SRE=18435"
"420","7.697276634","128.119.245.12","192.168.181.180","TCP","66","80  >  58276 [ACK] Seq=1 Ack=21171 Win=73728 Len=0 TSval=3521383947 TSecr=1727084283"
"421","7.697307616","192.168.181.180","128.119.245.12","TCP","1434","58276  >  80 [ACK] Seq=37587 Ack=1 Win=29312 Len=1368 TSval=1727084345 TSecr=3521383947"
"422","7.697315539","128.119.245.12","192.168.181.180","TCP","66","80  >  58276 [ACK] Seq=1 Ack=22539 Win=76672 Len=0 TSval=3521383947 TSecr=1727084283"
"423","7.697323863","128.119.245.12","192.168.181.180","TCP","66","80  >  58276 [ACK] Seq=1 Ack=23907 Win=79616 Len=0 TSval=3521383947 TSecr=1727084283"
"424","7.697331020","128.119.245.12","192.168.181.180","TCP","66","80  >  58276 [ACK] Seq=1 Ack=25275 Win=82432 Len=0 TSval=3521383948 TSecr=1727084283"
"425","7.697341378","192.168.181.180","128.119.245.12","TCP","1434","58276  >  80 [ACK] Seq=38955 Ack=1 Win=29312 Len=1368 TSval=1727084345 TSecr=3521383948"
"426","7.697345222","128.119.245.12","192.168.181.180","TCP","66","80  >  58276 [ACK] Seq=1 Ack=26643 Win=85376 Len=0 TSval=3521383948 TSecr=1727084283"
"427","7.697352494","128.119.245.12","192.168.181.180","TCP","66","80  >  58276 [ACK] Seq=1 Ack=28011 Win=88192 Len=0 TSval=3521383948 TSecr=1727084283"
"428","7.697359590","128.119.245.12","192.168.181.180","TCP","66","80  >  58276 [ACK] Seq=1 Ack=29379 Win=91136 Len=0 TSval=3521383948 TSecr=1727084283"
"429","7.697385105","128.119.245.12","192.168.181.180","TCP","66","80  >  58276 [ACK] Seq=1 Ack=32115 Win=96640 Len=0 TSval=3521383948 TSecr=1727084283"
"430","7.697393905","128.119.245.12","192.168.181.180","TCP","66","80  >  58276 [ACK] Seq=1 Ack=33483 Win=99456 Len=0 TSval=3521383948 TSecr=1727084283"
"431","7.697434443","192.168.181.180","128.119.245.12","TCP","1434","58276  >  80 [ACK] Seq=40323 Ack=1 Win=29312 Len=1368 TSval=1727084345 TSecr=3521383948"
"432","7.697440347","192.168.181.180","128.119.245.12","TCP","1434","58276  >  80 [ACK] Seq=41691 Ack=1 Win=29312 Len=1368 TSval=1727084345 TSecr=3521383948"
"433","7.697992528","128.119.245.12","192.168.181.180","TCP","78","[TCP Dup ACK 430#1] 80  >  58276 [PSH, ACK] Seq=1 Ack=33483 Win=99456 Len=0 TSval=3521383948 TSecr=1727084283 SLE=38955 SRE=40323"
"434","7.698025348","192.168.181.180","128.119.245.12","TCP","1434","58276  >  80 [ACK] Seq=43059 Ack=1 Win=29312 Len=1368 TSval=1727084345 TSecr=3521383948"
"435","7.698098187","128.119.245.12","192.168.181.180","TCP","78","[TCP Dup ACK 430#2] 80  >  58276 [PSH, ACK] Seq=1 Ack=33483 Win=99456 Len=0 TSval=3521383948 TSecr=1727084283 SLE=38955 SRE=41691"
"436","7.698109914","192.168.181.180","128.119.245.12","TCP","1434","58276  >  80 [ACK] Seq=44427 Ack=1 Win=29312 Len=1368 TSval=1727084346 TSecr=3521383948"
"439","7.935346244","128.119.245.12","192.168.181.180","TCP","78","[TCP Dup ACK 430#3] 80  >  58276 [ACK] Seq=1 Ack=33483 Win=99456 Len=0 TSval=3521384185 TSecr=1727084283 SLE=19803 SRE=21171"
"440","7.937077216","128.119.245.12","192.168.181.180","TCP","66","80  >  58276 [ACK] Seq=1 Ack=34851 Win=102400 Len=0 TSval=3521384187 TSecr=1727084344"
"441","7.937101439","192.168.181.180","128.119.245.12","TCP","1434","58276  >  80 [PSH, ACK] Seq=45795 Ack=1 Win=29312 Len=1368 TSval=1727084405 TSecr=3521384187"
"442","7.937105283","128.119.245.12","192.168.181.180","TCP","66","80  >  58276 [ACK] Seq=1 Ack=36219 Win=105344 Len=0 TSval=3521384187 TSecr=1727084344"
"443","7.937109797","192.168.181.180","128.119.245.12","TCP","1434","58276  >  80 [ACK] Seq=47163 Ack=1 Win=29312 Len=1368 TSval=1727084405 TSecr=3521384187"
"444","7.937111509","128.119.245.12","192.168.181.180","TCP","78","[TCP Dup ACK 442#1] 80  >  58276 [ACK] Seq=1 Ack=36219 Win=105344 Len=0 TSval=3521384187 TSecr=1727084344 SLE=23907 SRE=25275"
"445","7.937114820","128.119.245.12","192.168.181.180","TCP","78","[TCP Dup ACK 442#2] 80  >  58276 [ACK] Seq=1 Ack=36219 Win=105344 Len=0 TSval=3521384187 TSecr=1727084344 SLE=28011 SRE=29379"
"446","7.937146429","192.168.181.180","128.119.245.12","TCP","1434","58276  >  80 [ACK] Seq=48531 Ack=1 Win=29312 Len=1368 TSval=1727084405 TSecr=3521384187"
"447","7.937172516","192.168.181.180","128.119.245.12","TCP","1434","58276  >  80 [ACK] Seq=49899 Ack=1 Win=29312 Len=1368 TSval=1727084405 TSecr=3521384187"
"448","7.937306798","128.119.245.12","192.168.181.180","TCP","66","80  >  58276 [ACK] Seq=1 Ack=37587 Win=108160 Len=0 TSval=3521384187 TSecr=1727084344"
"449","7.937327064","192.168.181.180","128.119.245.12","TCP","1434","58276  >  80 [ACK] Seq=51267 Ack=1 Win=29312 Len=1368 TSval=1727084405 TSecr=3521384187"
"450","7.937436330","192.168.181.180","128.119.245.12","TCP","1434","58276  >  80 [ACK] Seq=52635 Ack=1 Win=29312 Len=1368 TSval=1727084405 TSecr=3521384187"
"451","7.937796183","128.119.245.12","192.168.181.180","TCP","78","[TCP Dup ACK 448#1] 80  >  58276 [PSH, ACK] Seq=1 Ack=37587 Win=108160 Len=0 TSval=3521384187 TSecr=1727084344 SLE=47163 SRE=48531"
"452","7.937814536","192.168.181.180","128.119.245.12","TCP","1434","58276  >  80 [ACK] Seq=54003 Ack=1 Win=29312 Len=1368 TSval=1727084405 TSecr=3521384187"
"453","7.937871835","128.119.245.12","192.168.181.180","TCP","78","[TCP Dup ACK 448#2] 80  >  58276 [PSH, ACK] Seq=1 Ack=37587 Win=108160 Len=0 TSval=3521384187 TSecr=1727084344 SLE=47163 SRE=49899"
"454","7.937877719","192.168.181.180","128.119.245.12","TCP","1434","58276  >  80 [ACK] Seq=55371 Ack=1 Win=29312 Len=1368 TSval=1727084405 TSecr=3521384187"
"455","7.937880325","192.168.181.180","128.119.245.12","TCP","1434","58276  >  80 [ACK] Seq=56739 Ack=1 Win=29312 Len=1368 TSval=1727084405 TSecr=3521384187"
"456","7.938102806","128.119.245.12","192.168.181.180","TCP","78","[TCP Dup ACK 448#3] 80  >  58276 [PSH, ACK] Seq=1 Ack=37587 Win=108160 Len=0 TSval=3521384187 TSecr=1727084344 SLE=51267 SRE=52635"
"457","7.938107882","192.168.181.180","128.119.245.12","TCP","1434","58276  >  80 [ACK] Seq=58107 Ack=1 Win=29312 Len=1368 TSval=1727084406 TSecr=3521384187"
"458","7.938220511","128.119.245.12","192.168.181.180","TCP","78","[TCP Dup ACK 448#4] 80  >  58276 [PSH, ACK] Seq=1 Ack=37587 Win=108160 Len=0 TSval=3521384187 TSecr=1727084344 SLE=51267 SRE=54003"
"459","7.938227386","192.168.181.180","128.119.245.12","TCP","1434","[TCP Fast Retransmission] 58276  >  80 [ACK] Seq=37587 Ack=1 Win=29312 Len=1368 TSval=1727084406 TSecr=3521384187"
"460","7.938460732","128.119.245.12","192.168.181.180","TCP","78","[TCP Dup ACK 448#5] 80  >  58276 [PSH, ACK] Seq=1 Ack=37587 Win=108160 Len=0 TSval=3521384187 TSecr=1727084344 SLE=55371 SRE=56739"
"461","7.938470349","192.168.181.180","128.119.245.12","TCP","1434","[TCP Out-Of-Order] 58276  >  80 [ACK] Seq=41691 Ack=1 Win=29312 Len=1368 TSval=1727084406 TSecr=3521384187"
"462","7.938607197","128.119.245.12","192.168.181.180","TCP","78","[TCP Dup ACK 448#6] 80  >  58276 [PSH, ACK] Seq=1 Ack=37587 Win=108160 Len=0 TSval=3521384187 TSecr=1727084344 SLE=55371 SRE=58107"
"463","7.938616237","192.168.181.180","128.119.245.12","TCP","1434","[TCP Out-Of-Order] 58276  >  80 [ACK] Seq=43059 Ack=1 Win=29312 Len=1368 TSval=1727084406 TSecr=3521384187"
"464","7.942907696","128.119.245.12","192.168.181.180","TCP","66","80  >  58276 [ACK] Seq=1 Ack=41691 Win=116352 Len=0 TSval=3521384193 TSecr=1727084345"
"465","7.942917095","192.168.181.180","128.119.245.12","TCP","1434","58276  >  80 [PSH, ACK] Seq=59475 Ack=1 Win=29312 Len=1368 TSval=1727084407 TSecr=3521384193"
"466","7.942951857","192.168.181.180","128.119.245.12","TCP","1434","58276  >  80 [ACK] Seq=60843 Ack=1 Win=29312 Len=1368 TSval=1727084407 TSecr=3521384193"
"467","7.943151818","128.119.245.12","192.168.181.180","TCP","66","80  >  58276 [ACK] Seq=1 Ack=43059 Win=119296 Len=0 TSval=3521384193 TSecr=1727084345"
"468","7.943161320","192.168.181.180","128.119.245.12","TCP","1434","58276  >  80 [ACK] Seq=62211 Ack=1 Win=29312 Len=1368 TSval=1727084407 TSecr=3521384193"
"469","7.943275303","128.119.245.12","192.168.181.180","TCP","66","80  >  58276 [ACK] Seq=1 Ack=44427 Win=122240 Len=0 TSval=3521384193 TSecr=1727084345"
"470","7.943293831","192.168.181.180","128.119.245.12","TCP","1434","58276  >  80 [ACK] Seq=63579 Ack=1 Win=29312 Len=1368 TSval=1727084407 TSecr=3521384193"
"471","7.943296939","192.168.181.180","128.119.245.12","TCP","1306","58276  >  80 [PSH, ACK] Seq=64947 Ack=1 Win=29312 Len=1240 TSval=1727084407 TSecr=3521384193"
"472","7.943298927","128.119.245.12","192.168.181.180","TCP","66","80  >  58276 [ACK] Seq=1 Ack=45795 Win=125056 Len=0 TSval=3521384193 TSecr=1727084346"
"473","7.943682602","128.119.245.12","192.168.181.180","TCP","78","[TCP Dup ACK 472#1] 80  >  58276 [PSH, ACK] Seq=1 Ack=45795 Win=125056 Len=0 TSval=3521384193 TSecr=1727084346 SLE=60843 SRE=62211"
"474","7.943690486","192.168.181.180","128.119.245.12","TCP","1434","[TCP Out-Of-Order] 58276  >  80 [PSH, ACK] Seq=45795 Ack=1 Win=29312 Len=1368 TSval=1727084407 TSecr=3521384193"
"475","7.943808080","128.119.245.12","192.168.181.180","TCP","78","[TCP Dup ACK 472#2] 80  >  58276 [PSH, ACK] Seq=1 Ack=45795 Win=125056 Len=0 TSval=3521384193 TSecr=1727084346 SLE=60843 SRE=63579"
"476","7.943814405","192.168.181.180","128.119.245.12","TCP","1434","[TCP Out-Of-Order] 58276  >  80 [ACK] Seq=49899 Ack=1 Win=29312 Len=1368 TSval=1727084407 TSecr=3521384193"
"477","7.944026049","128.119.245.12","192.168.181.180","TCP","78","[TCP Dup ACK 472#3] 80  >  58276 [PSH, ACK] Seq=1 Ack=45795 Win=125056 Len=0 TSval=3521384193 TSecr=1727084346 SLE=64947 SRE=66187"
"478","7.944031422","192.168.181.180","128.119.245.12","TCP","1434","[TCP Out-Of-Order] 58276  >  80 [ACK] Seq=54003 Ack=1 Win=29312 Len=1368 TSval=1727084407 TSecr=3521384193"
"482","8.182698225","128.119.245.12","192.168.181.180","TCP","66","80  >  58276 [ACK] Seq=1 Ack=47163 Win=128000 Len=0 TSval=3521384433 TSecr=1727084405"
"483","8.182768312","192.168.181.180","128.119.245.12","TCP","1434","58276  >  80 [ACK] Seq=66187 Ack=1 Win=29312 Len=1368 TSval=1727084467 TSecr=3521384433"
"484","8.182775303","192.168.181.180","128.119.245.12","TCP","1434","58276  >  80 [ACK] Seq=67555 Ack=1 Win=29312 Len=1368 TSval=1727084467 TSecr=3521384433"
"485","8.182779864","128.119.245.12","192.168.181.180","TCP","66","80  >  58276 [ACK] Seq=1 Ack=49899 Win=133504 Len=0 TSval=3521384433 TSecr=1727084405"
"486","8.182878256","128.119.245.12","192.168.181.180","TCP","66","80  >  58276 [ACK] Seq=1 Ack=54003 Win=141696 Len=0 TSval=3521384433 TSecr=1727084405"
"487","8.182896664","192.168.181.180","128.119.245.12","TCP","1434","58276  >  80 [ACK] Seq=68923 Ack=1 Win=29312 Len=1368 TSval=1727084467 TSecr=3521384433"
"488","8.182901194","192.168.181.180","128.119.245.12","TCP","1434","58276  >  80 [ACK] Seq=70291 Ack=1 Win=29312 Len=1368 TSval=1727084467 TSecr=3521384433"
"489","8.183307021","128.119.245.12","192.168.181.180","TCP","66","80  >  58276 [ACK] Seq=1 Ack=58107 Win=149888 Len=0 TSval=3521384433 TSecr=1727084405"
"490","8.183373590","192.168.181.180","128.119.245.12","TCP","1434","58276  >  80 [ACK] Seq=71659 Ack=1 Win=29312 Len=1368 TSval=1727084467 TSecr=3521384433"
"491","8.183381263","192.168.181.180","128.119.245.12","TCP","1434","58276  >  80 [ACK] Seq=73027 Ack=1 Win=29312 Len=1368 TSval=1727084467 TSecr=3521384433"
"492","8.183387993","128.119.245.12","192.168.181.180","TCP","78","[TCP Dup ACK 489#1] 80  >  58276 [ACK] Seq=1 Ack=58107 Win=149888 Len=0 TSval=3521384434 TSecr=1727084405 SLE=37587 SRE=38955"
"493","8.183424006","192.168.181.180","128.119.245.12","TCP","1434","58276  >  80 [ACK] Seq=74395 Ack=1 Win=29312 Len=1368 TSval=1727084467 TSecr=3521384434"
"494","8.183436460","192.168.181.180","128.119.245.12","TCP","1434","58276  >  80 [ACK] Seq=75763 Ack=1 Win=29312 Len=1368 TSval=1727084467 TSecr=3521384434"
"495","8.183524073","128.119.245.12","192.168.181.180","TCP","78","[TCP Dup ACK 489#2] 80  >  58276 [PSH, ACK] Seq=1 Ack=58107 Win=149888 Len=0 TSval=3521384434 TSecr=1727084405 SLE=67555 SRE=68923"
"496","8.183557445","128.119.245.12","192.168.181.180","TCP","78","[TCP Dup ACK 489#3] 80  >  58276 [ACK] Seq=1 Ack=58107 Win=149888 Len=0 TSval=3521384434 TSecr=1727084405 SLE=41691 SRE=43059"
"497","8.183582969","128.119.245.12","192.168.181.180","TCP","78","[TCP Dup ACK 489#4] 80  >  58276 [ACK] Seq=1 Ack=58107 Win=149888 Len=0 TSval=3521384434 TSecr=1727084405 SLE=43059 SRE=44427"
"498","8.183605275","192.168.181.180","128.119.245.12","TCP","1434","58276  >  80 [ACK] Seq=77131 Ack=1 Win=29312 Len=1368 TSval=1727084467 TSecr=3521384434"
"499","8.183698416","128.119.245.12","192.168.181.180","TCP","78","[TCP Dup ACK 489#5] 80  >  58276 [PSH, ACK] Seq=1 Ack=58107 Win=149888 Len=0 TSval=3521384434 TSecr=1727084405 SLE=70291 SRE=71659"
"500","8.183728736","128.119.245.12","192.168.181.180","TCP","66","80  >  58276 [ACK] Seq=1 Ack=59475 Win=152832 Len=0 TSval=3521384434 TSecr=1727084406"
"501","8.183754505","192.168.181.180","128.119.245.12","TCP","1434","58276  >  80 [ACK] Seq=78499 Ack=1 Win=29312 Len=1368 TSval=1727084467 TSecr=3521384434"
"502","8.183778225","192.168.181.180","128.119.245.12","TCP","1434","58276  >  80 [ACK] Seq=79867 Ack=1 Win=29312 Len=1368 TSval=1727084467 TSecr=3521384434"
"503","8.184054473","128.119.245.12","192.168.181.180","TCP","78","[TCP Dup ACK 500#1] 80  >  58276 [PSH, ACK] Seq=1 Ack=59475 Win=152832 Len=0 TSval=3521384434 TSecr=1727084406 SLE=73027 SRE=74395"
"504","8.184093759","192.168.181.180","128.119.245.12","TCP","1434","58276  >  80 [ACK] Seq=81235 Ack=1 Win=29312 Len=1368 TSval=1727084467 TSecr=3521384434"
"505","8.184141589","128.119.245.12","192.168.181.180","TCP","78","[TCP Dup ACK 500#2] 80  >  58276 [PSH, ACK] Seq=1 Ack=59475 Win=152832 Len=0 TSval=3521384434 TSecr=1727084406 SLE=73027 SRE=75763"
"506","8.184153973","192.168.181.180","128.119.245.12","TCP","1434","58276  >  80 [ACK] Seq=82603 Ack=1 Win=29312 Len=1368 TSval=1727084467 TSecr=3521384434"
"507","8.184379499","128.119.245.12","192.168.181.180","TCP","78","[TCP Dup ACK 500#3] 80  >  58276 [PSH, ACK] Seq=1 Ack=59475 Win=152832 Len=0 TSval=3521384434 TSecr=1727084406 SLE=77131 SRE=78499"
"508","8.184395636","192.168.181.180","128.119.245.12","TCP","1434","58276  >  80 [ACK] Seq=83971 Ack=1 Win=29312 Len=1368 TSval=1727084467 TSecr=3521384434"
"509","8.188834971","128.119.245.12","192.168.181.180","TCP","66","80  >  58276 [ACK] Seq=1 Ack=60843 Win=155648 Len=0 TSval=3521384439 TSecr=1727084407"
"510","8.188897681","192.168.181.180","128.119.245.12","TCP","1434","58276  >  80 [ACK] Seq=85339 Ack=1 Win=29312 Len=1368 TSval=1727084468 TSecr=3521384439"
"511","8.188918825","128.119.245.12","192.168.181.180","TCP","66","80  >  58276 [ACK] Seq=1 Ack=63579 Win=161152 Len=0 TSval=3521384439 TSecr=1727084407"
"512","8.188931113","128.119.245.12","192.168.181.180","TCP","66","80  >  58276 [ACK] Seq=1 Ack=66187 Win=166400 Len=0 TSval=3521384439 TSecr=1727084407"
"513","8.188944419","192.168.181.180","128.119.245.12","TCP","1434","58276  >  80 [ACK] Seq=86707 Ack=1 Win=29312 Len=1368 TSval=1727084468 TSecr=3521384439"
"514","8.189169183","128.119.245.12","192.168.181.180","TCP","78","[TCP Dup ACK 512#1] 80  >  58276 [ACK] Seq=1 Ack=66187 Win=166400 Len=0 TSval=3521384439 TSecr=1727084407 SLE=45795 SRE=47163"
"515","8.189526108","128.119.245.12","192.168.181.180","TCP","78","[TCP Dup ACK 512#2] 80  >  58276 [ACK] Seq=1 Ack=66187 Win=166400 Len=0 TSval=3521384440 TSecr=1727084407 SLE=49899 SRE=51267"
"516","8.189552208","128.119.245.12","192.168.181.180","TCP","78","[TCP Dup ACK 512#3] 80  >  58276 [PSH, ACK] Seq=1 Ack=66187 Win=166400 Len=0 TSval=3521384440 TSecr=1727084407 SLE=86707 SRE=88075"
"517","8.189574399","192.168.181.180","128.119.245.12","TCP","1434","58276  >  80 [PSH, ACK] Seq=88075 Ack=1 Win=29312 Len=1368 TSval=1727084468 TSecr=3521384440"
"518","8.189702289","128.119.245.12","192.168.181.180","TCP","78","[TCP Dup ACK 512#4] 80  >  58276 [ACK] Seq=1 Ack=66187 Win=166400 Len=0 TSval=3521384440 TSecr=1727084407 SLE=54003 SRE=55371"
"519","8.428221379","128.119.245.12","192.168.181.180","TCP","66","80  >  58276 [ACK] Seq=1 Ack=68923 Win=171776 Len=0 TSval=3521384678 TSecr=1727084467"
"520","8.428417087","192.168.181.180","128.119.245.12","TCP","1434","58276  >  80 [ACK] Seq=89443 Ack=1 Win=29312 Len=1368 TSval=1727084528 TSecr=3521384678"
"521","8.428443133","128.119.245.12","192.168.181.180","TCP","66","80  >  58276 [ACK] Seq=1 Ack=71659 Win=177280 Len=0 TSval=3521384679 TSecr=1727084467"
"522","8.428466812","192.168.181.180","128.119.245.12","TCP","1434","58276  >  80 [ACK] Seq=90811 Ack=1 Win=29312 Len=1368 TSval=1727084528 TSecr=3521384679"
"523","8.428895793","128.119.245.12","192.168.181.180","TCP","66","80  >  58276 [ACK] Seq=1 Ack=75763 Win=181632 Len=0 TSval=3521384679 TSecr=1727084467"
"524","8.428913276","192.168.181.180","128.119.245.12","TCP","1434","58276  >  80 [ACK] Seq=92179 Ack=1 Win=29312 Len=1368 TSval=1727084528 TSecr=3521384679"
"525","8.429084599","128.119.245.12","192.168.181.180","TCP","78","[TCP Dup ACK 523#1] 80  >  58276 [PSH, ACK] Seq=1 Ack=75763 Win=181632 Len=0 TSval=3521384679 TSecr=1727084467 SLE=90811 SRE=92179"
"526","8.429102968","192.168.181.180","128.119.245.12","TCP","1434","58276  >  80 [ACK] Seq=93547 Ack=1 Win=29312 Len=1368 TSval=1727084528 TSecr=3521384679"
"527","8.429179781","128.119.245.12","192.168.181.180","TCP","66","80  >  58276 [ACK] Seq=1 Ack=79867 Win=181632 Len=0 TSval=3521384679 TSecr=1727084467"
"528","8.429195967","192.168.181.180","128.119.245.12","TCP","1434","58276  >  80 [ACK] Seq=94915 Ack=1 Win=29312 Len=1368 TSval=1727084528 TSecr=3521384679"
"529","8.429199898","192.168.181.180","128.119.245.12","TCP","1434","58276  >  80 [ACK] Seq=96283 Ack=1 Win=29312 Len=1368 TSval=1727084528 TSecr=3521384679"
"530","8.429217864","128.119.245.12","192.168.181.180","TCP","66","80  >  58276 [ACK] Seq=1 Ack=81235 Win=180608 Len=0 TSval=3521384679 TSecr=1727084467"
"531","8.429252233","192.168.181.180","128.119.245.12","TCP","1434","58276  >  80 [ACK] Seq=97651 Ack=1 Win=29312 Len=1368 TSval=1727084528 TSecr=3521384679"
"532","8.429416934","128.119.245.12","192.168.181.180","TCP","66","80  >  58276 [ACK] Seq=1 Ack=82603 Win=183296 Len=0 TSval=3521384680 TSecr=1727084467"
"533","8.429433176","192.168.181.180","128.119.245.12","TCP","1434","58276  >  80 [ACK] Seq=99019 Ack=1 Win=29312 Len=1368 TSval=1727084528 TSecr=3521384680"
"534","8.429436718","128.119.245.12","192.168.181.180","TCP","66","80  >  58276 [ACK] Seq=1 Ack=83971 Win=183296 Len=0 TSval=3521384680 TSecr=1727084467"
"535","8.429443411","192.168.181.180","128.119.245.12","TCP","1434","58276  >  80 [ACK] Seq=100387 Ack=1 Win=29312 Len=1368 TSval=1727084528 TSecr=3521384680"
"536","8.429750037","128.119.245.12","192.168.181.180","TCP","78","[TCP Dup ACK 534#1] 80  >  58276 [PSH, ACK] Seq=1 Ack=83971 Win=183296 Len=0 TSval=3521384680 TSecr=1727084467 SLE=94915 SRE=96283"
"537","8.429766843","192.168.181.180","128.119.245.12","TCP","1434","58276  >  80 [ACK] Seq=101755 Ack=1 Win=29312 Len=1368 TSval=1727084528 TSecr=3521384680"
"538","8.429829880","128.119.245.12","192.168.181.180","TCP","66","80  >  58276 [ACK] Seq=1 Ack=85339 Win=183296 Len=0 TSval=3521384680 TSecr=1727084467"
"539","8.429842903","192.168.181.180","128.119.245.12","TCP","1434","58276  >  80 [ACK] Seq=103123 Ack=1 Win=29312 Len=1368 TSval=1727084528 TSecr=3521384680"
"540","8.429869546","128.119.245.12","192.168.181.180","TCP","78","[TCP Dup ACK 538#1] 80  >  58276 [PSH, ACK] Seq=1 Ack=85339 Win=183296 Len=0 TSval=3521384680 TSecr=1727084467 SLE=94915 SRE=97651"
"541","8.429880473","192.168.181.180","128.119.245.12","TCP","1434","58276  >  80 [ACK] Seq=104491 Ack=1 Win=29312 Len=1368 TSval=1727084528 TSecr=3521384680"
"542","8.430151555","128.119.245.12","192.168.181.180","TCP","78","[TCP Dup ACK 538#2] 80  >  58276 [PSH, ACK] Seq=1 Ack=85339 Win=183296 Len=0 TSval=3521384680 TSecr=1727084467 SLE=99019 SRE=100387"
"543","8.430168297","192.168.181.180","128.119.245.12","TCP","1434","58276  >  80 [ACK] Seq=105859 Ack=1 Win=29312 Len=1368 TSval=1727084529 TSecr=3521384680"
"544","8.430218385","128.119.245.12","192.168.181.180","TCP","78","[TCP Dup ACK 538#3] 80  >  58276 [PSH, ACK] Seq=1 Ack=85339 Win=183296 Len=0 TSval=3521384680 TSecr=1727084467 SLE=99019 SRE=101755"
"545","8.430231573","192.168.181.180","128.119.245.12","TCP","1434","58276  >  80 [ACK] Seq=107227 Ack=1 Win=29312 Len=1368 TSval=1727084529 TSecr=3521384680"
"546","8.430450389","128.119.245.12","192.168.181.180","TCP","78","[TCP Dup ACK 538#4] 80  >  58276 [PSH, ACK] Seq=1 Ack=85339 Win=183296 Len=0 TSval=3521384680 TSecr=1727084467 SLE=103123 SRE=104491"
"547","8.430466813","192.168.181.180","128.119.245.12","TCP","1434","58276  >  80 [PSH, ACK] Seq=108595 Ack=1 Win=29312 Len=1368 TSval=1727084529 TSecr=3521384680"
"548","8.430639706","128.119.245.12","192.168.181.180","TCP","78","[TCP Dup ACK 538#5] 80  >  58276 [PSH, ACK] Seq=1 Ack=85339 Win=183296 Len=0 TSval=3521384680 TSecr=1727084467 SLE=103123 SRE=105859"
"549","8.430653944","192.168.181.180","128.119.245.12","TCP","1434","58276  >  80 [ACK] Seq=109963 Ack=1 Win=29312 Len=1368 TSval=1727084529 TSecr=3521384680"
"550","8.430996939","128.119.245.12","192.168.181.180","TCP","78","[TCP Dup ACK 538#6] 80  >  58276 [PSH, ACK] Seq=1 Ack=85339 Win=183296 Len=0 TSval=3521384680 TSecr=1727084467 SLE=107227 SRE=108595"
"551","8.431014056","192.168.181.180","128.119.245.12","TCP","1434","58276  >  80 [ACK] Seq=111331 Ack=1 Win=29312 Len=1368 TSval=1727084529 TSecr=3521384680"
"552","8.434379109","128.119.245.12","192.168.181.180","TCP","66","80  >  58276 [ACK] Seq=1 Ack=88075 Win=182528 Len=0 TSval=3521384685 TSecr=1727084468"
"553","8.434399590","192.168.181.180","128.119.245.12","TCP","1434","58276  >  80 [ACK] Seq=112699 Ack=1 Win=29312 Len=1368 TSval=1727084530 TSecr=3521384685"
"554","8.435002606","128.119.245.12","192.168.181.180","TCP","66","80  >  58276 [ACK] Seq=1 Ack=89443 Win=183296 Len=0 TSval=3521384685 TSecr=1727084468"
"555","8.435022464","192.168.181.180","128.119.245.12","TCP","1434","58276  >  80 [ACK] Seq=114067 Ack=1 Win=29312 Len=1368 TSval=1727084530 TSecr=3521384685"
"556","8.514125306","192.168.181.180","172.217.31.14","TCP","66","50970  >  443 [ACK] Seq=1 Ack=1 Win=237 Len=0 TSval=3603364739 TSecr=1426471971"
"557","8.520528983","172.217.31.14","192.168.181.180","TCP","66","[TCP ACKed unseen segment] 443  >  50970 [ACK] Seq=1 Ack=2 Win=170 Len=0 TSval=1426517027 TSecr=3603308176"
"559","8.673911489","128.119.245.12","192.168.181.180","TCP","66","80  >  58276 [ACK] Seq=1 Ack=92179 Win=182528 Len=0 TSval=3521384924 TSecr=1727084528"
"560","8.673964776","192.168.181.180","128.119.245.12","TCP","1434","58276  >  80 [ACK] Seq=115435 Ack=1 Win=29312 Len=1368 TSval=1727084589 TSecr=3521384924"
"561","8.673971131","192.168.181.180","128.119.245.12","TCP","1434","58276  >  80 [ACK] Seq=116803 Ack=1 Win=29312 Len=1368 TSval=1727084589 TSecr=3521384924"
"562","8.674430663","128.119.245.12","192.168.181.180","TCP","66","80  >  58276 [ACK] Seq=1 Ack=93547 Win=183296 Len=0 TSval=3521384925 TSecr=1727084528"
"563","8.674465552","192.168.181.180","128.119.245.12","TCP","1434","58276  >  80 [ACK] Seq=118171 Ack=1 Win=29312 Len=1368 TSval=1727084590 TSecr=3521384925"
"564","8.674471365","128.119.245.12","192.168.181.180","TCP","66","80  >  58276 [ACK] Seq=1 Ack=97651 Win=180608 Len=0 TSval=3521384925 TSecr=1727084528"
"565","8.674480213","192.168.181.180","128.119.245.12","TCP","1434","58276  >  80 [ACK] Seq=119539 Ack=1 Win=29312 Len=1368 TSval=1727084590 TSecr=3521384925"
"566","8.674624270","128.119.245.12","192.168.181.180","TCP","78","[TCP Dup ACK 564#1] 80  >  58276 [PSH, ACK] Seq=1 Ack=97651 Win=180608 Len=0 TSval=3521384925 TSecr=1727084528 SLE=116803 SRE=118171"
"567","8.674649224","192.168.181.180","128.119.245.12","TCP","1434","58276  >  80 [ACK] Seq=120907 Ack=1 Win=29312 Len=1368 TSval=1727084590 TSecr=3521384925"
"568","8.675142675","128.119.245.12","192.168.181.180","TCP","66","80  >  58276 [ACK] Seq=1 Ack=101755 Win=181632 Len=0 TSval=3521384925 TSecr=1727084528"
"569","8.675177127","192.168.181.180","128.119.245.12","TCP","1434","58276  >  80 [ACK] Seq=122275 Ack=1 Win=29312 Len=1368 TSval=1727084590 TSecr=3521384925"
"570","8.675227159","128.119.245.12","192.168.181.180","TCP","78","[TCP Dup ACK 568#1] 80  >  58276 [PSH, ACK] Seq=1 Ack=101755 Win=181632 Len=0 TSval=3521384925 TSecr=1727084528 SLE=119539 SRE=120907"
"571","8.675244367","192.168.181.180","128.119.245.12","TCP","1434","58276  >  80 [ACK] Seq=123643 Ack=1 Win=29312 Len=1368 TSval=1727084590 TSecr=3521384925"
"572","8.675320334","128.119.245.12","192.168.181.180","TCP","66","80  >  58276 [ACK] Seq=1 Ack=105859 Win=181632 Len=0 TSval=3521384926 TSecr=1727084528"
"573","8.675335630","192.168.181.180","128.119.245.12","TCP","1434","58276  >  80 [ACK] Seq=125011 Ack=1 Win=29312 Len=1368 TSval=1727084590 TSecr=3521384926"
"574","8.675595698","128.119.245.12","192.168.181.180","TCP","66","80  >  58276 [ACK] Seq=1 Ack=108595 Win=182528 Len=0 TSval=3521384926 TSecr=1727084529"
"575","8.675603656","192.168.181.180","128.119.245.12","TCP","1434","58276  >  80 [PSH, ACK] Seq=126379 Ack=1 Win=29312 Len=1368 TSval=1727084590 TSecr=3521384926"
"576","8.675766417","128.119.245.12","192.168.181.180","TCP","66","80  >  58276 [ACK] Seq=1 Ack=109963 Win=183296 Len=0 TSval=3521384926 TSecr=1727084529"
"577","8.675779791","192.168.181.180","128.119.245.12","TCP","1434","58276  >  80 [ACK] Seq=127747 Ack=1 Win=29312 Len=1368 TSval=1727084590 TSecr=3521384926"
"578","8.675839790","128.119.245.12","192.168.181.180","TCP","78","[TCP Dup ACK 576#1] 80  >  58276 [PSH, ACK] Seq=1 Ack=109963 Win=183296 Len=0 TSval=3521384926 TSecr=1727084529 SLE=123643 SRE=125011"
"579","8.675853806","192.168.181.180","128.119.245.12","TCP","1434","58276  >  80 [ACK] Seq=129115 Ack=1 Win=29312 Len=1368 TSval=1727084590 TSecr=3521384926"
"580","8.676325456","128.119.245.12","192.168.181.180","TCP","86","[TCP Dup ACK 576#2] 80  >  58276 [PSH, ACK] Seq=1 Ack=109963 Win=183296 Len=0 TSval=3521384926 TSecr=1727084529 SLE=126379 SRE=127747 SLE=123643 SRE=125011"
"581","8.676335086","192.168.181.180","128.119.245.12","TCP","1434","58276  >  80 [ACK] Seq=130483 Ack=1 Win=29312 Len=1368 TSval=1727084590 TSecr=3521384926"
"582","8.676473721","128.119.245.12","192.168.181.180","TCP","78","[TCP Dup ACK 576#3] 80  >  58276 [PSH, ACK] Seq=1 Ack=109963 Win=183296 Len=0 TSval=3521384926 TSecr=1727084529 SLE=126379 SRE=129115"
"583","8.676506856","192.168.181.180","128.119.245.12","TCP","1434","58276  >  80 [ACK] Seq=131851 Ack=1 Win=29312 Len=1368 TSval=1727084590 TSecr=3521384926"
"584","8.676569561","128.119.245.12","192.168.181.180","TCP","66","80  >  58276 [ACK] Seq=1 Ack=112699 Win=183296 Len=0 TSval=3521384927 TSecr=1727084529"
"585","8.676583598","192.168.181.180","128.119.245.12","TCP","1434","58276  >  80 [ACK] Seq=133219 Ack=1 Win=29312 Len=1368 TSval=1727084590 TSecr=3521384927"
"586","8.676587358","192.168.181.180","128.119.245.12","TCP","1434","58276  >  80 [ACK] Seq=134587 Ack=1 Win=29312 Len=1368 TSval=1727084590 TSecr=3521384927"
"587","8.676885303","128.119.245.12","192.168.181.180","TCP","78","[TCP Dup ACK 584#1] 80  >  58276 [PSH, ACK] Seq=1 Ack=112699 Win=183296 Len=0 TSval=3521384927 TSecr=1727084529 SLE=130483 SRE=131851"
"588","8.676894849","192.168.181.180","128.119.245.12","TCP","1434","58276  >  80 [ACK] Seq=135955 Ack=1 Win=29312 Len=1368 TSval=1727084590 TSecr=3521384927"
"589","8.677156141","128.119.245.12","192.168.181.180","TCP","78","[TCP Dup ACK 584#2] 80  >  58276 [PSH, ACK] Seq=1 Ack=112699 Win=183296 Len=0 TSval=3521384927 TSecr=1727084529 SLE=133219 SRE=134587"
"590","8.677165498","192.168.181.180","128.119.245.12","TCP","1434","58276  >  80 [ACK] Seq=137323 Ack=1 Win=29312 Len=1368 TSval=1727084590 TSecr=3521384927"
"591","8.677271636","128.119.245.12","192.168.181.180","TCP","78","[TCP Dup ACK 584#3] 80  >  58276 [PSH, ACK] Seq=1 Ack=112699 Win=183296 Len=0 TSval=3521384927 TSecr=1727084529 SLE=133219 SRE=135955"
"592","8.677280701","192.168.181.180","128.119.245.12","TCP","1434","58276  >  80 [ACK] Seq=138691 Ack=1 Win=29312 Len=1368 TSval=1727084590 TSecr=3521384927"
"593","8.677711137","128.119.245.12","192.168.181.180","TCP","86","[TCP Dup ACK 584#4] 80  >  58276 [PSH, ACK] Seq=1 Ack=112699 Win=183296 Len=0 TSval=3521384927 TSecr=1727084529 SLE=137323 SRE=138691 SLE=133219 SRE=135955"
"594","8.677745625","192.168.181.180","128.119.245.12","TCP","1434","58276  >  80 [ACK] Seq=140059 Ack=1 Win=29312 Len=1368 TSval=1727084590 TSecr=3521384927"
"595","8.677827253","128.119.245.12","192.168.181.180","TCP","86","[TCP Dup ACK 584#5] 80  >  58276 [PSH, ACK] Seq=1 Ack=112699 Win=183296 Len=0 TSval=3521384927 TSecr=1727084529 SLE=137323 SRE=140059 SLE=133219 SRE=135955"
"596","8.677843117","192.168.181.180","128.119.245.12","TCP","1434","58276  >  80 [ACK] Seq=141427 Ack=1 Win=29312 Len=1368 TSval=1727084590 TSecr=3521384927"
"597","8.678434823","128.119.245.12","192.168.181.180","TCP","78","[TCP Dup ACK 584#6] 80  >  58276 [PSH, ACK] Seq=1 Ack=112699 Win=183296 Len=0 TSval=3521384927 TSecr=1727084529 SLE=141427 SRE=142795"
"598","8.678503113","192.168.181.180","128.119.245.12","TCP","1434","58276  >  80 [PSH, ACK] Seq=142795 Ack=1 Win=29312 Len=1368 TSval=1727084591 TSecr=3521384927"
"599","8.680413487","128.119.245.12","192.168.181.180","TCP","66","80  >  58276 [ACK] Seq=1 Ack=115435 Win=183296 Len=0 TSval=3521384931 TSecr=1727084530"
"600","8.680461670","192.168.181.180","128.119.245.12","TCP","1434","[TCP Out-Of-Order] 58276  >  80 [ACK] Seq=115435 Ack=1 Win=29312 Len=1368 TSval=1727084591 TSecr=3521384931"
"601","8.680468771","192.168.181.180","128.119.245.12","TCP","1434","[TCP Out-Of-Order] 58276  >  80 [ACK] Seq=118171 Ack=1 Win=29312 Len=1368 TSval=1727084591 TSecr=3521384931"
"603","8.919716021","128.119.245.12","192.168.181.180","TCP","66","80  >  58276 [ACK] Seq=1 Ack=118171 Win=183296 Len=0 TSval=3521385170 TSecr=1727084589"
"604","8.919765702","192.168.181.180","128.119.245.12","TCP","1434","58276  >  80 [ACK] Seq=144163 Ack=1 Win=29312 Len=1368 TSval=1727084651 TSecr=3521385170"
"605","8.919771402","192.168.181.180","128.119.245.12","TCP","1434","58276  >  80 [ACK] Seq=145531 Ack=1 Win=29312 Len=1368 TSval=1727084651 TSecr=3521385170"
"606","8.920610611","128.119.245.12","192.168.181.180","TCP","66","80  >  58276 [ACK] Seq=1 Ack=120907 Win=183296 Len=0 TSval=3521385171 TSecr=1727084590"
"607","8.920659701","192.168.181.180","128.119.245.12","TCP","1434","58276  >  80 [ACK] Seq=146899 Ack=1 Win=29312 Len=1368 TSval=1727084651 TSecr=3521385171"
"608","8.920665595","192.168.181.180","128.119.245.12","TCP","1434","58276  >  80 [ACK] Seq=148267 Ack=1 Win=29312 Len=1368 TSval=1727084651 TSecr=3521385171"
"609","8.921109631","128.119.245.12","192.168.181.180","TCP","66","80  >  58276 [ACK] Seq=1 Ack=125011 Win=183296 Len=0 TSval=3521385171 TSecr=1727084590"
"610","8.921160548","192.168.181.180","128.119.245.12","TCP","1434","58276  >  80 [ACK] Seq=149635 Ack=1 Win=29312 Len=1368 TSval=1727084651 TSecr=3521385171"
"611","8.921166211","192.168.181.180","128.119.245.12","TCP","1434","58276  >  80 [ACK] Seq=151003 Ack=1 Win=29312 Len=1368 TSval=1727084651 TSecr=3521385171"
"612","8.921171319","128.119.245.12","192.168.181.180","TCP","66","80  >  58276 [ACK] Seq=1 Ack=129115 Win=183296 Len=0 TSval=3521385171 TSecr=1727084590"
"613","8.921196186","192.168.181.180","128.119.245.12","TCP","667","58276  >  80 [PSH, ACK] Seq=152371 Ack=1 Win=29312 Len=601 TSval=1727084651 TSecr=3521385171"
"614","8.921366166","128.119.245.12","192.168.181.180","TCP","78","[TCP Dup ACK 612#1] 80  >  58276 [PSH, ACK] Seq=1 Ack=129115 Win=183296 Len=0 TSval=3521385171 TSecr=1727084590 SLE=148267 SRE=149635"
"615","8.921669333","128.119.245.12","192.168.181.180","TCP","66","80  >  58276 [ACK] Seq=1 Ack=131851 Win=183296 Len=0 TSval=3521385172 TSecr=1727084590"
"616","8.921895171","128.119.245.12","192.168.181.180","TCP","86","[TCP Dup ACK 615#1] 80  >  58276 [PSH, ACK] Seq=1 Ack=131851 Win=183296 Len=0 TSval=3521385172 TSecr=1727084590 SLE=151003 SRE=152371 SLE=148267 SRE=149635"
"617","8.921928856","128.119.245.12","192.168.181.180","TCP","86","[TCP Dup ACK 615#2] 80  >  58276 [PSH, ACK] Seq=1 Ack=131851 Win=183296 Len=0 TSval=3521385172 TSecr=1727084590 SLE=151003 SRE=152972 SLE=148267 SRE=149635"
"618","8.921949273","192.168.181.180","128.119.245.12","TCP","1434","[TCP Fast Retransmission] 58276  >  80 [ACK] Seq=131851 Ack=1 Win=29312 Len=1368 TSval=1727084651 TSecr=3521385172"
"619","8.922834959","128.119.245.12","192.168.181.180","TCP","66","80  >  58276 [ACK] Seq=1 Ack=140059 Win=178560 Len=0 TSval=3521385173 TSecr=1727084590"
"620","8.923486597","128.119.245.12","192.168.181.180","TCP","66","80  >  58276 [ACK] Seq=1 Ack=142795 Win=182528 Len=0 TSval=3521385174 TSecr=1727084590"
"621","8.925764356","128.119.245.12","192.168.181.180","TCP","78","80  >  58276 [ACK] Seq=1 Ack=144163 Win=183296 Len=0 TSval=3521385176 TSecr=1727084591 SLE=118171 SRE=119539"
"622","8.925812835","192.168.181.180","128.119.245.12","TCP","1434","[TCP Out-Of-Order] 58276  >  80 [ACK] Seq=144163 Ack=1 Win=29312 Len=1368 TSval=1727084652 TSecr=3521385176"
"623","8.925818361","192.168.181.180","128.119.245.12","TCP","1434","[TCP Out-Of-Order] 58276  >  80 [ACK] Seq=145531 Ack=1 Win=29312 Len=1368 TSval=1727084652 TSecr=3521385176"
"624","8.926156352","128.119.245.12","192.168.181.180","TCP","78","[TCP Dup ACK 621#1] 80  >  58276 [ACK] Seq=1 Ack=144163 Win=183296 Len=0 TSval=3521385176 TSecr=1727084591 SLE=115435 SRE=116803"
"625","8.926172993","192.168.181.180","128.119.245.12","TCP","1434","[TCP Out-Of-Order] 58276  >  80 [ACK] Seq=146899 Ack=1 Win=29312 Len=1368 TSval=1727084653 TSecr=3521385176"
"629","9.166434848","128.119.245.12","192.168.181.180","TCP","66","80  >  58276 [ACK] Seq=1 Ack=145531 Win=183296 Len=0 TSval=3521385415 TSecr=1727084651"
"630","9.166458523","128.119.245.12","192.168.181.180","TCP","66","80  >  58276 [ACK] Seq=1 Ack=146899 Win=183296 Len=0 TSval=3521385415 TSecr=1727084651"
"631","9.168532208","128.119.245.12","192.168.181.180","TCP","66","80  >  58276 [ACK] Seq=1 Ack=149635 Win=182528 Len=0 TSval=3521385418 TSecr=1727084651"
"632","9.168564714","128.119.245.12","192.168.181.180","TCP","66","80  >  58276 [ACK] Seq=1 Ack=152972 Win=181632 Len=0 TSval=3521385418 TSecr=1727084651"
"633","9.168570381","128.119.245.12","192.168.181.180","TCP","78","[TCP Window Update] 80  >  58276 [ACK] Seq=1 Ack=152972 Win=183296 Len=0 TSval=3521385418 TSecr=1727084651 SLE=131851 SRE=133219"
"634","9.168744496","128.119.245.12","192.168.181.180","TCP","843","80  >  58276 [PSH, ACK] Seq=1 Ack=152972 Win=183296 Len=777 TSval=3521385418 TSecr=1727084651"
"635","9.168779881","192.168.181.180","128.119.245.12","TCP","66","58276  >  80 [ACK] Seq=152972 Ack=778 Win=32128 Len=0 TSval=1727084713 TSecr=3521385418"
"636","9.171790880","128.119.245.12","192.168.181.180","TCP","78","[TCP Dup ACK 632#1] 80  >  58276 [ACK] Seq=778 Ack=152972 Win=183296 Len=0 TSval=3521385422 TSecr=1727084651 SLE=145531 SRE=146899"
"637","9.171812898","128.119.245.12","192.168.181.180","TCP","78","[TCP Dup ACK 632#2] 80  >  58276 [ACK] Seq=778 Ack=152972 Win=183296 Len=0 TSval=3521385422 TSecr=1727084651 SLE=144163 SRE=145531"
"638","9.171815308","128.119.245.12","192.168.181.180","TCP","78","[TCP Dup ACK 632#3] 80  >  58276 [ACK] Seq=778 Ack=152972 Win=183296 Len=0 TSval=3521385422 TSecr=1727084651 SLE=146899 SRE=148267"
"655","10.984633434","103.235.47.74","192.168.181.180","TCP","60","80  >  57223 [FIN, ACK] Seq=1 Ack=1 Win=504 Len=0"
"660","11.270596671","192.168.181.180","103.235.47.74","TCP","54","57223  >  80 [ACK] Seq=1 Ack=2 Win=455 Len=0"
"682","12.610175132","192.168.181.180","172.217.31.14","TCP","66","43466  >  443 [ACK] Seq=1 Ack=1 Win=362 Len=0 TSval=3603365763 TSecr=1378403527"
"683","12.610200723","192.168.181.180","172.217.31.3","TCP","66","45534  >  443 [ACK] Seq=1 Ack=1 Win=339 Len=0 TSval=2652054890 TSecr=964856594"
"684","12.616499273","172.217.31.3","192.168.181.180","TCP","66","[TCP ACKed unseen segment] 443  >  45534 [ACK] Seq=1 Ack=2 Win=170 Len=0 TSval=964901651 TSecr=2651998122"
"685","12.616534567","172.217.31.14","192.168.181.180","TCP","66","[TCP ACKed unseen segment] 443  >  43466 [ACK] Seq=1 Ack=2 Win=303 Len=0 TSval=1378448584 TSecr=3603309164"
"703","14.172736114","128.119.245.12","192.168.181.180","TCP","66","80  >  58276 [FIN, ACK] Seq=778 Ack=152972 Win=183296 Len=0 TSval=3521390423 TSecr=1727084713"
"704","14.214139182","192.168.181.180","128.119.245.12","TCP","66","58276  >  80 [ACK] Seq=152972 Ack=779 Win=32128 Len=0 TSval=1727085975 TSecr=3521390423"
"707","14.658206358","192.168.181.180","157.240.16.16","TCP","66","35536  >  443 [ACK] Seq=1 Ack=1 Win=1444 Len=0 TSval=4211479820 TSecr=1212772012"
"708","14.658239795","192.168.181.180","216.58.212.131","TCP","66","60370  >  443 [ACK] Seq=1 Ack=1 Win=339 Len=0 TSval=1646189308 TSecr=2552825384"
"709","14.685441628","157.240.16.16","192.168.181.180","TCP","66","[TCP ACKed unseen segment] 443  >  35536 [ACK] Seq=1 Ack=2 Win=2043 Len=0 TSval=1212818522 TSecr=4211468200"
"711","14.824141321","192.168.181.180","128.119.245.12","TCP","66","58276  >  80 [FIN, ACK] Seq=152972 Ack=779 Win=32128 Len=0 TSval=1727086127 TSecr=3521390423"
"714","15.021001144","216.58.212.131","192.168.181.180","TCP","66","[TCP ACKed unseen segment] 443  >  60370 [ACK] Seq=1 Ack=2 Win=175 Len=0 TSval=2552872169 TSecr=1646143298"
"715","15.068796922","128.119.245.12","192.168.181.180","TCP","66","80  >  58276 [ACK] Seq=779 Ack=152973 Win=183296 Len=0 TSval=3521391319 TSecr=1727086127"
